{"$schema":"https://artemsemdev.github.io/SeaRise-Europe/contracts/settlements/v3/reconciliation-report.schema.json","canonicalGeometryClaim":false,"dataProvenanceClass":"synthetic-fixture","dataReleaseId":"searise-europe-v1.0.0-20260812-939053bab621","deterministicIdentity":"b0fcf9ba2de151fa1804d96344917a974c1dec3acf9651479402c48fd0928ca2","dimensions":{"coastalStatuses":[{"classified":1,"key":"coastal","spatialRejected":0,"total":1},{"classified":1,"key":"inland","spatialRejected":0,"total":1},{"classified":0,"key":"outside-support","spatialRejected":1,"total":1}],"countries":[{"classified":2,"key":"DE","spatialRejected":0,"total":2},{"classified":0,"key":"HR","spatialRejected":1,"total":1}],"featureClasses":[{"classified":2,"key":"P","spatialRejected":1,"total":3}],"featureCodes":[{"classified":1,"key":"PPL","spatialRejected":1,"total":2},{"classified":1,"key":"PPLC","spatialRejected":0,"total":1}],"languages":[{"classified":2,"key":"de","spatialRejected":1,"total":3},{"classified":1,"key":"en","spatialRejected":0,"total":1},{"classified":0,"key":"hr","spatialRejected":1,"total":1},{"classified":1,"key":"und","spatialRejected":0,"total":1}],"populationBands":[{"classified":1,"key":"100000-plus","spatialRejected":0,"total":1},{"classified":0,"key":"unknown","spatialRejected":1,"total":1},{"classified":1,"key":"zero","spatialRejected":0,"total":1}],"scripts":[{"classified":4,"key":"Latn","spatialRejected":1,"total":5},{"classified":0,"key":"Zzzz","spatialRejected":1,"total":1}]},"geometryStatus":"selected-scope-approximation","hazardExtentClaim":false,"method":{"missingLanguageKey":"und","missingScriptKey":"Zzzz","nameDimensionUnit":"selected-normalized-name","placeDimensionUnit":"normalized-place","populationBandOrder":["unknown","zero","1-499","500-999","1000-9999","10000-99999","100000-plus"],"populationBandVersion":"settlement-population-band-v1"},"nameFlow":{"classifiedSelectedNames":4,"selectedNames":6,"spatialRejectedSelectedNames":2},"ownerApprovalClaim":false,"productionClaim":false,"publicationClaim":false,"recordFlow":{"catalogueAccepted":3,"catalogueRejected":1,"sourcePlaceRows":4,"spatialClassified":2,"spatialRejected":1},"rejections":{"catalogue":[{"count":1,"reason":"feature-code-not-included"}],"spatial":[{"count":1,"reason":"outside-support"}]},"reportType":"settlement-reconciliation","schemaVersion":"1.0.0","scientificApprovalClaim":false,"signingClaim":false,"sourceBindings":{"catalogue":{"candidateIdentity":"6f0bd09e4c405d6b8cb2e2cfdcbce376e19337654917bfd724252e307f112ffe","databaseByteSize":798720,"databaseSha256":"879bb803d75c0cf2c1c86017c70c9631d3a350c95dbf3b734d90bc6bccf64402","receiptByteSize":1436,"receiptSha256":"6217e2711cb435e3864a259a4cc2caa1ed9624b17ab0df355a57c4b1a8821141","stageSchemaVersion":"normalized-catalogue-stage-v1"},"spatial":{"candidateIdentity":"d225c8ecc8309ae8e685506780cf88147edaa521212050140a25c47666463091","databaseByteSize":798720,"databaseSha256":"cf54f68e915d7f61b10b4f6c624522d2e9060881d5848da884f7b5de8596f608","geometryContractSha256":"c7cd3fe7863ea4845444a674ec6f0ba9ef9a73ff0925e714067ac8c8a8196187","receiptByteSize":2114,"receiptSha256":"1d47264bcdff3bf5365b000d75a08b3f2a8b22546eb4dce3a2cb3c2320a63125","stageSchemaVersion":"spatial-classification-stage-v1"}}}
